{
  "schema_version": "omnipath.recognition-pathology/v1",
  "pathology_id": "rp-replay-001",
  "run_id": "run-001",
  "rail": "cross-rail",
  "pathology_type": "REPLAY_DIVERGENCE",
  "severity": "HIGH",
  "observed_evidence": [{
    "evidence_id": "e-001",
    "kind": "output-hash",
    "value": "sha256:actual",
    "source_ref": "run-001/output"
  }],
  "observer_judgment": {
    "observer_id": "c-observer-001",
    "judgment": "Replay output diverged from the expected digest.",
    "confidence": 1.0,
    "assumptions": []
  },
  "contradictions": [{
    "left_ref": "replay.expected_hash",
    "right_ref": "replay.actual_hash",
    "status": "OPEN",
    "resolution_ref": null
  }],
  "replay": {
    "claimed_deterministic": true,
    "replay_id": "replay-001",
    "expected_hash": "sha256:expected",
    "actual_hash": "sha256:actual",
    "match": false
  },
  "provenance": {
    "constitutional_root_sha": "a730bba4e6a466e15b95c47998ae403c0ffe3a23",
    "root_freeze_sha": "07f11ddf005f054d7172c7e1232c2b89a5a8ec65",
    "parent_refs": ["run-001"],
    "transform_refs": [],
    "model_identity": "fixture-model@immutable-revision",
    "prompt_hash": "sha256:prompt"
  },
  "scope": {
    "supports": ["The recorded replay diverged."],
    "does_not_support": ["The model is globally nondeterministic."]
  },
  "promotion_effect": "REQUIRE_ADJUDICATION",
  "epistemic_state": "CONTRADICTED",
  "notes": ["Adversarial conformance fixture."]
}
